{
  "$": {
    "id": "design",
    "name": "设计师作品集",
    "description": "手办原型师画廊风格：暖米白摄影棚背景、漆红点缀、衬线细字重标题、左分类栏 + 瀑布流作品网格、单列沉浸阅读、简洁页脚。",
    "version": "1.1.0",
    "author": "token00",
    "preview": "/styles/design/preview.png",
    "builtin": true,
    "defaultTheme": "light",
    "tags": [
      "design",
      "portfolio",
      "creative"
    ]
  },
  "design": {
    "tokens": {
      "--bg-primary": "#f5f3ee",
      "--bg-secondary": "#ffffff",
      "--bg-tertiary": "#efeae0",
      "--text-primary": "#1a1a1a",
      "--text-secondary": "#4a4a48",
      "--text-muted": "#8c8880",
      "--accent-blue": "#a8311f",
      "--accent-purple": "#7c2418",
      "--accent-blue-dim": "#7c2418",
      "--border-color": "rgba(163,153,133,0.4)",
      "--hover-bg": "rgba(168,49,31,0.06)",
      "--gradient-from": "#a8311f",
      "--gradient-via": "#7c2418",
      "--gradient-to": "#5c1810",
      "--grid-pattern": "transparent",
      "--selection-bg": "rgba(168,49,31,0.14)",
      "--scrollbar-thumb": "rgba(168,49,31,0.25)",
      "--scrollbar-thumb-hover": "rgba(168,49,31,0.45)",
      "--focus-ring": "rgba(168,49,31,0.5)",
      "--card-border-hover": "rgba(168,49,31,0.35)",
      "--section-divider": "rgba(168,49,31,0.15)",
      "--btn-glow-from": "transparent",
      "--btn-glow-to": "transparent",
      "--content-max-width": "1280px",
      "--reading-max-width": "760px",
      "--header-height": "72px",
      "--brand-font": "\"Cormorant Garamond\", Georgia, \"Times New Roman\", \"Songti SC\", \"Noto Serif SC\", \"SimSun\", serif",
      "--radius-card": "6px",
      "--shadow-card": "0 1px 2px rgba(30,20,10,.04), 0 8px 32px rgba(30,20,10,.04)",
      "--heading-weight": "400",
      "--heading-tracking": "-0.01em",
      "--dropcap-size": "3.6em",
      "--dropcap-line-height": "0.9",
      "--dropcap-margin": "8px 12px 0 0"
    },
    "theme": ":root{--bg-primary:#f5f3ee;--bg-secondary:#ffffff;--bg-tertiary:#efeae0;--text-primary:#1a1a1a;--text-secondary:#4a4a48;--text-muted:#8c8880;--accent-blue:#a8311f;--accent-purple:#7c2418;--accent-blue-dim:#7c2418;--border-color:rgba(163,153,133,0.4);--hover-bg:rgba(168,49,31,0.06);--gradient-from:#a8311f;--gradient-via:#7c2418;--gradient-to:#5c1810;--grid-pattern:transparent;--selection-bg:rgba(168,49,31,0.14);--scrollbar-thumb:rgba(168,49,31,0.25);--scrollbar-thumb-hover:rgba(168,49,31,0.45);--focus-ring:rgba(168,49,31,0.5);--card-border-hover:rgba(168,49,31,0.35);--section-divider:rgba(168,49,31,0.15);--btn-glow-from:transparent;--btn-glow-to:transparent;--content-max-width:1280px;--reading-max-width:760px;--header-height:72px;--brand-font:\"Cormorant Garamond\", Georgia, \"Times New Roman\", \"Songti SC\", \"Noto Serif SC\", \"SimSun\", serif;--radius-card:6px;--shadow-card:0 1px 2px rgba(30,20,10,.04), 0 8px 32px rgba(30,20,10,.04);--heading-weight:400;--heading-tracking:-0.01em;--dropcap-size:3.6em;--dropcap-line-height:0.9;--dropcap-margin:8px 12px 0 0;}"
  },
  "header": {
    "variant": "sticky-glass",
    "height": 72,
    "logo": {
      "type": "text",
      "text": "TokenPress",
      "position": "left",
      "height": 28,
      "link": "/"
    },
    "nav": {
      "source": "sections",
      "align": "center",
      "style": "plain",
      "icons": {},
      "colors": {
        "text": "#4a4a48",
        "hoverBg": "transparent",
        "hoverText": "#1a1a1a",
        "activeBg": "transparent",
        "activeText": "#a8311f",
        "barBg": "rgba(245,243,238,0.85)",
        "barText": "#1a1a1a"
      }
    },
    "actions": [
      {
        "type": "search",
        "icon": "search",
        "style": "icon"
      },
      {
        "type": "theme",
        "icon": "palette",
        "style": "icon"
      },
      {
        "type": "language",
        "icon": "globe",
        "style": "ghost",
        "label": {
          "zh": "中文",
          "en": "EN"
        }
      }
    ],
    "background": "rgba(245,243,238,0.85)",
    "borderBottom": "1px solid rgba(163,153,133,0.4)"
  },
  "hero": {
    "enabled": false,
    "size": "standard",
    "autoplay": true,
    "interval": 5,
    "showCTA": false,
    "ctaButtons": []
  },
  "layouts": {
    "homepage": {
      "container": "full",
      "sections": [
        {
          "component": "CustomBlock",
          "props": {
            "size": "hero",
            "background": "#f5f3ee",
            "split": {
              "enabled": true,
              "ratio": "1/1.4"
            },
            "eyebrow": "— FIGURE DESIGNER · 手办原型师",
            "title": "把角色塑成收藏",
            "titleAccent": "塑成收藏",
            "intro": "我是一名原型设计师，专注于角色造型与限定手办的雕塑造物。在这里记录每一件作品从草图、翻模到涂装完成的全过程。",
            "stats": [
              {
                "value": "12",
                "label": "件完成作品"
              },
              {
                "value": "4",
                "label": "在制原型"
              },
              {
                "value": "2024 —",
                "label": ""
              }
            ],
            "media": {
              "source": "latest",
              "aspect": "4/5",
              "badge": "LATEST · 最新作品"
            },
            "cta": {
              "label": "查看作品集",
              "href": "/works",
              "style": "primary"
            },
            "cta2": {
              "label": "制作工艺",
              "href": "/craft",
              "style": "outline"
            }
          }
        },
        {
          "component": "ArticleList",
          "variant": "masonry",
          "heading": {
            "label": "Works · 作品",
            "title": "近期作品",
            "more": {
              "label": "查看全部",
              "href": "/works"
            }
          },
          "props": {
            "source": "latest",
            "limit": 12,
            "showViewToggle": false
          }
        },
        {
          "component": "CustomBlock",
          "props": {
            "eyebrow": "About · 关于",
            "title": "关于",
            "intro": "我以「原型师」自居 —— 像塑造一件收藏级手办一样对待每一个设计：起稿、打样、上色，直到它能被陈列、被注视、被带走。",
            "background": "#efeae0",
            "signature": "— HXP"
          }
        }
      ]
    },
    "section": {
      "layout": "page-sidebar-left",
      "hero": {
        "enabled": true,
        "label": "Works · 作品",
        "title": "全部作品",
        "description": true,
        "align": "left",
        "divider": true
      },
      "sidebar": {
        "enabled": true,
        "sticky": true,
        "label": "Category · 分类",
        "metaBlock": {
          "title": "已收录",
          "lines": [
            "06 件完成作品",
            "04 件原型制作中",
            "自 2024 起"
          ]
        },
        "showSearch": true,
        "showTags": true
      },
      "list": {
        "layout": "masonry",
        "columns": 3,
        "showThumbnail": true,
        "showExcerpt": false,
        "cardStyle": "clean"
      },
      "subcategory": {
        "enabled": true,
        "position": "sidebar",
        "style": "list",
        "showCount": true
      }
    },
    "article": {
      "layout": "single",
      "showTOC": false,
      "showAuthor": true,
      "sidebar": "none",
      "maxWidth": 760,
      "dropcap": {
        "enabled": true
      }
    },
    "list": {
      "layout": "masonry",
      "columns": 2
    },
    "category": {
      "layout": "page-sidebar-left",
      "hero": {
        "enabled": false
      },
      "sidebar": {
        "enabled": true,
        "sticky": true
      },
      "list": {
        "layout": "masonry",
        "columns": 3,
        "showThumbnail": true,
        "showExcerpt": false,
        "cardStyle": "clean"
      },
      "subcategory": {
        "enabled": true,
        "position": "sidebar",
        "style": "list",
        "showCount": true
      }
    },
    "templates": {
      "article-list": {
        "columns": 1,
        "gap": "1.5rem",
        "showThumbnail": true,
        "showExcerpt": false,
        "cardStyle": "clean"
      },
      "article-grid": {
        "columns": 3,
        "gap": "1.5rem",
        "aspectRatio": "1/1",
        "showThumbnail": true,
        "showExcerpt": false,
        "cardStyle": "clean"
      },
      "article-masonry": {
        "columns": 2,
        "gap": "1.5rem",
        "aspectRatio": "auto",
        "showThumbnail": true,
        "showExcerpt": false,
        "cardStyle": "clean"
      },
      "magazine": {
        "columns": 2,
        "gap": "1.5rem",
        "showThumbnail": true,
        "showExcerpt": false,
        "cardStyle": "clean"
      },
      "single-page": {
        "maxWidth": 760,
        "centered": true
      },
      "link-wall": {
        "columns": 4,
        "gap": "1rem",
        "pill": true
      },
      "design-gallery": {
        "layout": "masonry",
        "columns": 3,
        "gap": "2rem",
        "aspectCycle": [
          "3/4",
          "1/1",
          "4/5"
        ],
        "cardStyle": "flat",
        "numberStyle": "watermark",
        "showCategoryBadge": true,
        "numberPrefix": "N°",
        "showMeta": true,
        "showTags": true,
        "showExcerpt": false,
        "showAuthor": false
      }
    }
  },
  "footer": {
    "variant": "simple",
    "columns": [],
    "friendLinks": {
      "show": false,
      "source": "table",
      "items": [],
      "maxItems": 20
    },
    "bottom": {
      "social": [],
      "showBackToTop": true
    },
    "background": "#f5f3ee",
    "textColor": "#4a4a48"
  },
  "features": {
    "readingProgressBar": false,
    "backToTop": true,
    "welcomeOverlay": false,
    "languageSwitcher": "icon"
  }
}
